{
  "context": {
    "specversion": "0.5.1",
    "id": "F4BD2B55-B6F6-4F44-AF72-BD2D0E7A8708",
    "chainId": "4c8cb7dd-3448-41de-8768-eec704e2829b",
    "source": "/monitoring/prod1",
    "type": "dev.cdevents.incident.reported.0.3.0",
    "timestamp": "2022-11-11T13:52:20.079Z",
    "schemaUri": "https://myorg.com/schema/custom",
    "links": [
      {
        "linkType": "RELATION",
        "linkKind": "TRIGGER",
        "target": {
          "contextId": "5328c37f-bb7e-4bb7-84ea-9f5f85e4a7ce"
        },
        "tags": {
          "foo1": "bar",
          "foo2": "bar"
        }
      }, {
        "linkType": "PATH",
        "from": {
          "contextId": "5328c37f-bb7e-4bb7-84ea-9f5f85e4a7ce"
        },
        "tags": {
          "foo1": "bar",
          "foo2": "bar"
        }
      }, {
        "linkType": "END",
        "from": {
          "contextId": "5328c37f-bb7e-4bb7-84ea-9f5f85e4a7ce"
        },
        "tags": {
          "foo1": "bar",
          "foo2": "bar"
        }
      }
    ]
  },
  "subject": {
    "id": "incident-123",
    "source": "/monitoring/prod1",
    "content": {
      "description": "Response time above threshold of 100ms",
      "environment": {
        "id": "prod1",
        "source": "/iaas/geo1"
      },
      "service": {
        "id": "myApp",
        "source": "/clusterA/namespaceB"
      },
      "artifactId": "pkg:oci/myapp@sha256%3A0b31b1c02ff458ad9b7b81cbdf8f028bd54699fa151f221d1e8de6817db93427",
      "ticketURI": "https://my-issues.example/incidents/ticket-345"
    }
  },
  "customData": {
    "severity": "medium",
    "priority": "critical",
    "reportedBy": "userId"
  },
  "customDataContentType": "application/json"
}
